{
  "$schema": "http://json-schema.org/draft-07/schema#",
  "$id": "pulse:ArticleShape.schema.json",
  "title": "ArticleShape",
  "description": "Schema for validating Article entities following Open Pulse Ontology v2.1.2. ID hierarchy: doi → infoscienceArticleIdentifier → uuid. Cross-references use hierarchical IDs when available.",
  "type": "object",
  "additionalProperties": false,
  "required": ["id", "type", "shacl", "identifiers", "idSource", "schema:name", "schema:identifier", "schema:datePublished", "schema:author"],
  "properties": {
    "id": {
      "type": "string",
      "description": "Resolved hierarchical identifier (first non-null in priority: doi → infoscienceArticleIdentifier → uuid)"
    },
    "type": {
      "type": "string",
      "const": "schema:ScholarlyArticle"
    },
    "shacl": {
      "type": "string",
      "const": "pulse:ArticleShape"
    },
    "identifiers": {
      "type": "object",
      "additionalProperties": false,
      "required": ["schema:identifier", "uuid"],
      "properties": {
        "schema:identifier": {
          "type": "string",
          "pattern": "^10\\.\\d{4,9}/[-._;()/:a-zA-Z0-9]+$",
          "description": "DOI identifier (required per SHACL minCount 1)"
        },
        "pulse:infoscienceArticleIdentifier": {
          "type": ["string", "null"],
          "pattern": "^[0-9a-f]{8}-[0-9a-f]{4}-4[0-9a-f]{3}-[89ab][0-9a-f]{3}-[0-9a-f]{12}$"
        },
        "uuid": {
          "type": "string",
          "pattern": "^[0-9a-f]{8}-[0-9a-f]{4}-4[0-9a-f]{3}-[89ab][0-9a-f]{3}-[0-9a-f]{12}$"
        }
      }
    },
    "idSource": {
      "type": "string",
      "enum": ["schema:identifier", "pulse:infoscienceArticleIdentifier", "uuid"]
    },
    "schema:name": {
      "type": "string",
      "minLength": 1,
      "description": "Article title"
    },
    "schema:identifier": {
      "type": "string",
      "pattern": "^10\\.\\d{4,9}/[-._;()/:a-zA-Z0-9]+$",
      "description": "DOI identifier (required per SHACL minCount 1)"
    },
    "schema:datePublished": {
      "type": "string",
      "pattern": "^\\d{4}-\\d{2}-\\d{2}$",
      "description": "Publication date in ISO 8601 date format (YYYY-MM-DD)"
    },
    "schema:author": {
      "type": "array",
      "minItems": 1,
      "items": {
        "type": "string",
        "description": "Reference to PersonShape hierarchical ID (orcid, infosciencePersonIdentifier, githubUsername, or uuid)"
      }
    },
    "pulse:infoscienceArticleIdentifier": {
      "type": ["string", "null"],
      "pattern": "^[0-9a-f]{8}-[0-9a-f]{4}-4[0-9a-f]{3}-[89ab][0-9a-f]{3}-[0-9a-f]{12}$"
    },
    "schema:sourceOrganization": {
      "type": ["string", "null"],
      "description": "Reference to OrganizationShape hierarchical ID (ror, infoscienceOrganizationIdentifier, githubOrganizationHandle, or uuid)"
    }
  }
}
