[
  {
    "id": "https://doi.org/10.1038/s41586-024-07856-z",
    "type": "schema:ScholarlyArticle",
    "shacl": "pulse:ArticleShape",
    "identifiers": {
      "schema:identifier": "https://doi.org/10.1038/s41586-024-07856-z",
      "pulse:infoscienceArticleIdentifier": "https://infoscience.epfl.ch/entities/publication/c8e2a1b4-5f3d-47a9-b6c8-9d4e7f2a3b1c",
      "uuid": "f8a3b2c1-4d5e-4f6a-8b9c-1d2e3f4a5b6c"
    },
    "idSource": "schema:identifier",
    "schema:name": "Open Pulse: A Framework for Tracking Scientific Software Contributions",
    "schema:identifier": "https://doi.org/10.1038/s41586-024-07856-z",
    "schema:datePublished": "2025-06-15",
    "schema:author": [
      "0000-0001-2345-6789",
      "0000-0003-4567-8901"
    ],
    "pulse:infoscienceArticleIdentifier": "https://infoscience.epfl.ch/entities/publication/c8e2a1b4-5f3d-47a9-b6c8-9d4e7f2a3b1c",
    "schema:sourceOrganization": "https://infoscience.epfl.ch/entities/orgunit/95372c6b-7d45-432e-a84e-660c9fa54e05"
  },
  {
    "id": "https://doi.org/10.1016/j.softx.2023.101456",
    "type": "schema:ScholarlyArticle",
    "shacl": "pulse:ArticleShape",
    "identifiers": {
      "schema:identifier": "https://doi.org/10.1016/j.softx.2023.101456",
      "pulse:infoscienceArticleIdentifier": "https://infoscience.epfl.ch/entities/publication/a4c8e2f1-7d3b-49a6-b5c8-2e1f9a7b6c4d",
      "uuid": "f1e2d3c4-5b6a-4789-abcd-ef1234567890"
    },
    "idSource": "schema:identifier",
    "schema:name": "Gimie: Automated Git Metadata Extraction for Research Software",
    "schema:identifier": "https://doi.org/10.1016/j.softx.2023.101456",
    "schema:datePublished": "2023-11-20",
    "schema:author": [
      "0000-0001-2345-6789",
      "0000-0002-3456-7890"
    ],
    "pulse:infoscienceArticleIdentifier": "https://infoscience.epfl.ch/entities/publication/a4c8e2f1-7d3b-49a6-b5c8-2e1f9a7b6c4d",
    "schema:sourceOrganization": "https://ror.org/02s376052"
  },
  {
    "id": "https://doi.org/10.1109/TBME.2024.3123456",
    "type": "schema:ScholarlyArticle",
    "shacl": "pulse:ArticleShape",
    "identifiers": {
      "schema:identifier": "https://doi.org/10.1109/TBME.2024.3123456",
      "pulse:infoscienceArticleIdentifier": "https://infoscience.epfl.ch/entities/publication/b3d7e9f2-1a4c-48e6-9f5d-7c2b8a6e4f1d",
      "uuid": "f4c3b2a1-8d7e-4f6a-9b4c-3d2e1f0a9b8c"
    },
    "idSource": "schema:identifier",
    "schema:name": "Deep Learning Approaches for Biomedical Image Segmentation",
    "schema:identifier": "https://doi.org/10.1109/TBME.2024.3123456",
    "schema:datePublished": "2024-08-10",
    "schema:author": [
      "mweber"
    ],
    "pulse:infoscienceArticleIdentifier": "https://infoscience.epfl.ch/entities/publication/b3d7e9f2-1a4c-48e6-9f5d-7c2b8a6e4f1d",
    "schema:sourceOrganization": "https://ror.org/05a28rw58"
  },
  {
    "id": "https://doi.org/10.1145/3597503.3639187",
    "type": "schema:ScholarlyArticle",
    "shacl": "pulse:ArticleShape",
    "identifiers": {
      "schema:identifier": "https://doi.org/10.1145/3597503.3639187",
      "pulse:infoscienceArticleIdentifier": null,
      "uuid": "f5d4c3b2-1a0e-4f9d-8c7b-6a5e4d3c2b1a"
    },
    "idSource": "schema:identifier",
    "schema:name": "Reproducible Workflows for Large-Scale Particle Physics Simulations",
    "schema:identifier": "https://doi.org/10.1145/3597503.3639187",
    "schema:datePublished": "2024-04-22",
    "schema:author": [
      "0000-0003-4567-8901",
      "e1f2a3b4-5c6d-4e7f-8a9b-0c1d2e3f4a5b"
    ],
    "pulse:infoscienceArticleIdentifier": null,
    "schema:sourceOrganization": "https://ror.org/01ggx4157"
  }
]
